<xs:schema xmlns:xs = "http://www.w3.org/2001/XMLSchema">

	<xs:include schemaLocation="fieldStructures.xsd" />

	<xs:element name="assessment" type="Assessment" />

	<xs:complexType name="Assessment">
		<xs:sequence>
			<xs:element name="basicInformation" type="AssessmentInformation" maxOccurs="1" />
			<xs:element name="field" type="Field"  maxOccurs="170" minOccurs="0" />
			<xs:element name="tree" type="Tree" maxOccurs="170" minOccurs="0" />
		</xs:sequence>
		<xs:attribute name="id" type="xs:ID" />
	</xs:complexType>
	
	<xs:complexType name="AssessmentInformation">
		<xs:sequence>
			<xs:element name="speciesName" type="xs:string" minOccurs="1" maxOccurs="1" />
			<xs:element name="commonName" type="xs:string" minOccurs="1" maxOccurs="1" />
			<xs:element name="taxonomicAuthority" type="xs:string" />
			<xs:element name="assessmentType" type="AssessmentType" minOccurs="1" maxOccurs="1" />
			<xs:element name="region" type="xs:string" minOccurs="0" maxOccurs="1" />
			<xs:element name="kingdom" type="xs:string" minOccurs="1" maxOccurs="1" />						
			<xs:element name="phylum" type="xs:string" minOccurs="1" maxOccurs="1" />
			<xs:element name="class" type="xs:string" minOccurs="0" maxOccurs="1" />
			<xs:element name="order" type="xs:string" minOccurs="0" maxOccurs="1" />
			<xs:element name="family" type="xs:string" minOccurs="0" maxOccurs="1" />
			<xs:element name="rank" type="xs:string" minOccurs="0" maxOccurs="1" />
			<xs:element name="infrarank" type="xs:string" minOccurs="0" maxOccurs="1" />
			<xs:element name="subpopulation" type="xs:string" minOccurs="0" maxOccurs="1" />
			<xs:element name="plantType" type="xs:boolean" minOccurs="0" maxOccurs="1" />
		</xs:sequence>
	</xs:complexType> 
	
	<xs:complexType name="AssessmentType">
		<xs:choice>
			<xs:element name="global" />
			<xs:element name="regional" type="xs:string" nillable="false" />
		</xs:choice>	
	</xs:complexType>
	
	<xs:complexType name="References">
		<xs:sequence>
			<xs:element name="referenceId" type="xs:string" nillable="false" minOccurs="1" maxOccurs="unbounded"/>
		</xs:sequence>
	</xs:complexType>
	
	<xs:complexType name="Field">
		<xs:sequence>
			<xs:element name="canonicalName" type="xs:string" minOccurs="1" maxOccurs="1" />
			<xs:element name="description" type="xs:string" minOccurs="1" maxOccurs="1" />
			<xs:element name="classOfService" type="xs:string" minOccurs="1" maxOccurs="1" />
			<xs:element name="location" type="xs:string" minOccurs="1" maxOccurs="1" />
			<xs:element name="references" type="References" minOccurs="0" maxOccurs="1" />
			<xs:element name="structures" type="FieldStructure" minOccurs="1" maxOccurs="1" />
		</xs:sequence>
		<xs:attribute name="style" type="xs:string" use="optional" />
		<xs:attribute name="id" type="xs:integer" />
	</xs:complexType>
	
	<xs:complexType name="Tree">
		<xs:sequence>
			<xs:element name="canonicalName" type="xs:string" minOccurs="1" maxOccurs="1" />
			<xs:element name="description" type="xs:string" minOccurs="1" maxOccurs="1" />
			<xs:element name="classOfService" type="xs:string" minOccurs="1" maxOccurs="1" />
			<xs:element name="location" type="xs:string" minOccurs="1" maxOccurs="1" />
			<xs:element name="references" type="References" minOccurs="0" maxOccurs="1" />
			<xs:element name="treeRoot" type="TreeRoot" minOccurs="1" maxOccurs="1" />
		</xs:sequence>
		<xs:attribute name="style" type="xs:string" use="optional" />
		<xs:attribute name="id" type="xs:integer" />
	</xs:complexType>
	
</xs:schema>